{
  "$schema": "https://json-schema.org/draft/2020-12/schema",
  "$id": "https://tesserae.local/schema/hardware.schema.json",
  "title": "Tesserae hardware catalog entry",
  "description": "A data-only SKU definition that derives a device kind from an existing protocol-level device folder. The hardware entry brings identity (name, vendor, url), panel specifics (dims, gamut, native stride), and optional protocol-specific defaults; the referenced protocol contributes the wire-format implementation (parse_status, validate_config, status/config topics).",
  "type": "object",
  "required": ["tesserae_compat", "id", "name", "vendor", "protocol", "panel"],
  "properties": {
    "tesserae_compat": {
      "type": "string",
      "pattern": "^\\d+\\.(x|\\d+)(\\..*)?$",
      "description": "Host major-version compatibility, same convention as device.json."
    },
    "id": {
      "type": "string",
      "pattern": "^[a-z][a-z0-9_]*$",
      "description": "Unique kind id for this SKU. Used in URLs, device-instance kind_of references, and the compatibility matrix. Cannot collide with an existing devices/<id>/ folder; folder always wins on conflict."
    },
    "name": { "type": "string", "minLength": 1 },
    "vendor": { "type": "string", "minLength": 1 },
    "url": { "type": "string", "format": "uri" },
    "icon": {
      "type": "string",
      "description": "Phosphor icon slug (no 'ph-' prefix). Falls back to the protocol's icon when absent."
    },
    "description": { "type": "string" },
    "protocol": {
      "type": "string",
      "pattern": "^[a-z][a-z0-9_]*$",
      "description": "Id of the protocol-level device folder under devices/ whose Python module supplies parse_status / validate_config and whose manifest contributes status_topic / config_topic / renderers / config_schema defaults. Validated at load time against the registry."
    },
    "panel": {
      "type": "object",
      "required": ["w", "h"],
      "description": "Physical panel for this SKU. Replaces the protocol's default panel block wholesale; native_w/native_h are forwarded to renderers that pack at firmware stride.",
      "properties": {
        "w": { "type": "integer", "minimum": 1 },
        "h": { "type": "integer", "minimum": 1 },
        "orientation": {
          "type": "string",
          "enum": ["landscape", "landscape_flipped", "portrait", "portrait_flipped"]
        },
        "name": { "type": "string" },
        "gamut": { "type": "string", "description": "Panel colour gamut id (e.g. 'waveshare_e6'/'spectra_6', 'inky_7colour'/'acep_7colour', 'bwry_4', 'bwr_3', 'gray_4', 'gray_8', 'gray_16', 'mono', 'kaleido3'). Colour gamuts are read by the quantizer when packing the .bin buffer; grayscale/mono ids are metadata for the renderer and colour-capability surfaces; 'kaleido3' (E Ink Kaleido 3 colour e-readers) is per-channel 4-bit RGB served as a PNG by a renderer that declares it under 'gamuts'." },
        "native_w": { "type": "integer", "minimum": 1 },
        "native_h": { "type": "integer", "minimum": 1 },
        "col_offset": { "type": "integer", "minimum": 0, "description": "Hidden-column padding inside the native buffer: x-offset of the first visible column. Only meaningful alongside native_w/native_h wider than the visible w; when present the .bin packers pad the frame with white instead of scaling to the native width (Seeed 2.13\" BWRY: 122 visible in a 128-wide JD79676 buffer, col_offset 6)." },
        "underscan": { "type": "integer", "minimum": 0 }
      }
    },
    "protocol_config": {
      "type": "object",
      "description": "Free-form protocol-specific defaults. Each protocol decides what's meaningful here (e.g. TRMNL BYOS reads 'model_header' to drive auto-provisioning; MQTT bin pushers read 'image_format'). Validation is the protocol's responsibility, not this schema's.",
      "additionalProperties": true
    },
    "config_schema_extends": {
      "type": "object",
      "description": "Optional additions to the protocol's config_schema, merged additively over the protocol's defaults. Same shape as device.json config_schema. Use sparingly; most SKUs should inherit the protocol's form as-is.",
      "additionalProperties": {
        "type": "object",
        "required": ["type"],
        "properties": {
          "type": { "enum": ["int", "float", "string", "boolean", "select"] },
          "label": { "type": "string" },
          "default": {},
          "min": { "type": "number" },
          "max": { "type": "number" },
          "choices": { "type": "array" },
          "presets": { "type": "array" },
          "help": { "type": "string" }
        }
      }
    },
    "refresh_floor_s": {
      "type": "integer",
      "minimum": 1,
      "description": "The repaint floor the profile lists for this glass, in seconds. A declaration, not a guarantee: it appears in the \"?\" help on the device card's cadence fields and in the Companion API, and nothing gates on it. Not a poll cadence, since a poll is a conditional GET and a 304 never reaches the glass."
    },
    "image_format": {
      "type": "string",
      "enum": ["png", "bin", "webp"],
      "description": "Wire format this SKU expects. Informational; the protocol's renderers still drive the actual encoding."
    },
    "touch": {
      "type": "boolean",
      "description": "Whether this SKU's panel has a digitizer. A hardware fact, distinct from the firmware's touch_enabled config. Set true and Tesserae's touch dispatch and the editors' Interaction UI apply to the panel, and the device APIs report it so agents and the editor know it is tappable. Absent → not tappable."
    },
    "renderers": {
      "type": "array",
      "items": { "type": "string", "pattern": "^[a-z][a-z0-9_]*$" },
      "minItems": 1,
      "description": "Optional override for the protocol's default renderer list. Present when the same wire protocol serves panels with meaningfully different output formats, e.g. a colour Spectra 6 panel wants an indexed-palette PNG while the mono panels on the same protocol take 1-bit output. Absent → inherit the protocol's renderers verbatim (the common case)."
    },
    "colour_depths": {
      "type": "object",
      "minProperties": 2,
      "propertyNames": { "pattern": "^[a-z][a-z0-9_]*$" },
      "additionalProperties": { "type": "string", "pattern": "^[a-z][a-z0-9_]*$" },
      "description": "Colour depths this board can paint, as panel gamut -> renderer id (each renderer must be one the kind offers). The depth served by the kind's first renderer is the baseline every firmware paints; any other depth is used only when the device has advertised that gamut in the 'gamuts' array of its register / status body, so a unit on older firmware stays on the baseline even if the operator picked another depth. Drives the device card's Colour depth control."
    },
    "colour_depth_default": {
      "type": "string",
      "pattern": "^[a-z][a-z0-9_]*$",
      "description": "The depth (a key of 'colour_depths') a device that advertises it starts on when no depth has been picked. Devices that have not advertised it stay on the baseline. Set to the baseline gamut to keep every device on it by default."
    },
    "notes_md": {
      "type": "string",
      "description": "Free-form maintainer notes in markdown. Surfaced on the docs hardware page."
    },
    "auto_select": {
      "type": "boolean",
      "default": true,
      "description": "Whether a device's self-report may be resolved to this SKU automatically (relay pairing infers the most specific kind from the reported protocol + gamut). Set false for a variant that is indistinguishable on the wire from a sibling SKU and differs only in which firmware image was flashed: nothing the device sends can identify it, so guessing risks pinning the panel to the wrong OTA lineage. Such a kind is only ever set explicitly by the operator, or by the firmware declaring it at register / discover."
    },
    "deprecated_aliases": {
      "type": "array",
      "items": { "type": "string", "pattern": "^[a-z][a-z0-9_]*$" },
      "description": "Older kind ids this SKU also registers under, so device instances created against the old id keep resolving. Only add when actually renaming a previously-shipped kind."
    }
  }
}
