{
  "tesserae_compat": "1.x",
  "id": "xteink_x4",
  "name": "Xteink X4",
  "vendor": "Xteink",
  "url": "https://www.xteink.com/",
  "icon": "device-tablet",
  "description": "4.26 inch monochrome ePaper e-reader, ESP32-C3, 800x480 panel mounted portrait (480x800 presentation). Two firmware paths speak Tesserae's v1 REST device API: CrossInk with Tesserae client support, which paints the dashboard as the reader's sleep screen on an explicit sleep transition (the radio never comes up on a timer), and the native Tesserae device firmware (`xteink-x4`), which polls on the normal deep-sleep cadence with the power button advancing the rotation. Server-side pack via esp32_bw_bin produces a raw 1-bpp mono buffer (48000 bytes) painted with no on-device decode; both firmwares consume identical bytes.",
  "protocol": "esp32_bw_client",
  "renderers": [
    "esp32_bw_bin",
    "esp32_gray2_bin"
  ],
  "colour_depths": {
    "mono": "esp32_bw_bin",
    "gray_4": "esp32_gray2_bin"
  },
  "colour_depth_default": "mono",
  "panel": {
    "w": 480,
    "h": 800,
    "orientation": "portrait_flipped",
    "name": "4.26 inch monochrome ePaper (800x480 native)",
    "gamut": "mono",
    "native_w": 800,
    "native_h": 480
  },
  "refresh_floor_s": 60,
  "image_format": "bin",
  "notes_md": "Confirmed on real hardware (GDEQ0426T82 / SSD1677) on both firmware paths: CrossInk 1.4.0 with Tesserae client support, and the native Tesserae device firmware (tesserae-device-firmware env `xteink-x4`).\n\nWire format is exactly 48000 bytes (800*480/8), MSB=leftmost pixel, bit-set=white, bit-clear=black; no header, no padding, no checksum, identical to seeed_reterminal_e1001 and xiao_epaper_75.\n\nOrientation is the ordinary presentational setting and the two firmwares agree on it: the same registration (`portrait_flipped`, this entry's default) has painted upright on both CrossInk and the native firmware on the same unit, so no per-firmware value is needed. Pick the orientation matching the physical mounting, as on any panel. Historical diagnosis note: plain `portrait` painted 180 degrees out (readable, rotated, no mirror), first isolated by registering the unit against the landscape `xiao_epaper_75` kind, hence the flipped default for a reader stood upright.\n\nXteink shipped a second panel revision mid-production (SSD1677 -> UC8179; later runs also UC8279). CrossInk detects the controller at boot and both revisions consume the same buffer, so no separate SKU is needed there. The native Tesserae firmware is an SSD1677-only build: a UC8179/UC8279 unit will not refresh on it at all and needs a firmware target of its own.\n\nSee `xteink_x4_gray` for the 4-level grayscale kind CrossInk uses. The native Tesserae firmware stays on this kind for both depths (see Colour depth below).\n\n**Colour depth.** Mono is the default. Firmware that advertises `\"gamuts\": [\"mono\", \"gray_4\"]` in its register and status bodies can also paint a 4-level grey frame from `esp32_gray2_bin`: exactly 96000 bytes (800*480/4) at the 800x480 native stride, the exact frame `xteink_x4_gray` gets, 4 px/byte MSB first, `0b00` black to `0b11` white. The firmware tells the two apart by byte length (48000 mono, 96000 grey), keeps the same kind, model and device id, and only firmware that advertises `gray_4` gets a grey frame, whatever the device card says. Older firmware omits the key and stays on mono. Pick the depth on the device card (Rendering, Colour depth). The grey path is UNVERIFIED ON HARDWARE and needs a firmware build that advertises `gamuts`. Relay-paired panels do not advertise it and stay mono."
}
